score,title,date,text
7/10,Barbie's breathtaking visuals and practical effects outshine the erratic storytelling to make a fresh and innovative movie with themes that will be divisive for many.,09 2023,"Barbie is a visually stunning achievement that has excelled at the box office while dividing audiences. On the one hand, Barbie amazes with extravagant practical sets and exceptional performances, but on the other hand, the story and directing feel chaotic and erratic. The target audience seems to be moms who played with Barbies and would bring their daughters to the film. Therefore, some film's themes feel more grown up than expected for a movie about a child's toy. Despite probably not being the primary target demographic, I enjoyed the film, especially Margot Robbie and Ryan Gosling's performance. They elevated the story and script to the successful giant the movie has become. The casting of Kate McKinnon and Will Ferrell was perfect for the roles they portrayed. The sets and production design were some of the most impressive I have ever seen in a film! The story was unfocused and unpredictable but also fun and lighthearted. While I wouldn't say Barbie was perfect, and its themes a little too complex for a movie about a toy, its production design and unique story stood out in an era of remakes and sequels."
10/10,Everyone over the age of 6 should watch it,07 2023,"Haters can hate all they want. It's a brilliant movie. I could not have asked for anything more. In 2023, We live in a complex society with extreme sexism which has been brilliantly addressed by none other than Barbie! The last Product that one would expect to address this issue. Was it perfect, no- nothing is perfect today. It didn't cover many topics. But did it do an excellent job at covering the topic they decided to address - absolutely YES! They can take my money - again and again for creating content that is relevant and important and changes all our perspectives. The cast was brilliant. I can't believe how many people they roped in. And Margot Robbie and Ryan Gosling were AMAZING as Barbie and Ken."
7/10,"It's an OK movie, runs a little long but funny enough to be decently entertaining",08 2023,"This movie is about the best movie you can make with the Barbie franchise. I still found it to be a relatively average movie. I suspect part of that may be that I'm not the originally intended audience, but it may also be that this movie wants to be a thought provoking and social commentary film while handcuffed to the Barbie IP."
10/10,Barbie,07 2023,Warning: Spoilers
7/10,Not a movie but a long tiktok video.,07 2023,Warning: Spoilers
2/10,"""The Matrix"" re imagined in pink and neon... it doesn't work",09 2023,Warning: Spoilers
10/10,Amazing!,07 2023,"Great film which has a good balance between politics, feminism and film making. It was funny, sad and exciting, with great acting to pull it off. The set was incredible and the dances were amazing which really added to the story line. The ending was perfect and showed how barbie has impacted audiences positively and negatively. Mattel really own the so called bad barbies that they discontinued and it is clear either why they were discontinued but also maybe why they weren't necessary to be discontinued. Overall a great film and good to see with the family, it would be really recommended if you have younger children! They should love it."
3/10,A very poor film,09 2023,"I heard it was preachy before going to watch it, but still expected it to be a fun, easy watch. I feel like this is being rated higher because people think there's an important message in there but this shouldn't distract anyone from the fact that it's a very, very bad film with a terrible storyline. After a promising start it becomes excruciatingly boring and predictable. The storyline is what you'd expect from a poorly written children's film, but its wrapped in a heavy handed adult theme. Box office smash but it will be forgotten very quickly. Only highlights were Margot Robbie's performance and Michael Cera and Kate Mckinnons small but funny parts."
10/10,A Beautiful Commentary on the Real World,07 2023,Warning: Spoilers
6/10,OK,07 2023,The movie is okay if you wanna have a laugh and entertainment.
10/10,Wonderful,07 2023,"Such a silly, beautiful, wonderful movie! This is truly a cinematic masterpiece. It has heart, soul, and lots of laughs. I've seen it twice so far and it honestly gets better with each watch. I'm looking forward to owning it when it comes out for purchase as well. This will definitely be one I watch a lot. Ryan Gosling's Ken is everything, and he's absolutely perfect. This entire movie is perfect. I don't want to say too much and spoil anything for those that haven't seen it yet, so just go ahead and do yourself a favor and go see it. What are you waiting for? P. S. Isn't not ""sexist"" it's making a point, and people that have a problem with what it's saying should probably ask themselves why and look inwards."
7/10,Hard movie to review,09 2023,"""Barbie"" to me is one of the harder movies to review because I don't know whether I liked it or not. This review will just come from the hip and i'm going to list the good and the bad and finally rate it off of what i've reviewed, so here goes..."
7/10,The Kenergy was Kenough for me.,07 2023,Barbie.
2/10,music video non-movie,08 2023,"Barbie has color and some music and dancing. There's no movie in there though, as taken as a whole it's a mess of illogic and heavy handed pronouncements. The ""real word"" is as fake as a 3 dollar bill. A universe called real world might be thought of as portraying, well, the real world, but it doesn't. When straining for humor, it mostly doesn't work. Furthermore, none of the characters in Barbie are interesting or someone one wants to relate to in a narrative. Some of the historical Barbie items are interesting to look at. Why this movie is popular I don't know, but the film will soon be forgotten."
8/10,"The last act was such a redeemer. I love you, Greta! [+78%]",09 2023,Warning: Spoilers
7/10,Starts well..but goes downhil!,08 2023,Warning: Spoilers
3/10,"Didn't live up,to the hype.",08 2023,"I think the extensive hype and the long standing popularity of the Barbie brand are responsible for bringing several generations of fans into the theaters resulting in the opening sales. It certainly isn't the movie, itself. The storyline was overly simplistic, poorly written and I didn't find its style of absurd humor to be funny. The movie relied a lot on sight gags that I thought fell flat. The ending seemed to come out of the blue and was a poor attempt at profundity. Margot Robbie IS the consummate Barbie, but she pretty much plays ""actress Barbie"" in everything she does, so it wasn't anything groundbreaking for her. I thought Gloria and Sasha were the best characters and the combination of their performances along with the costumes and sets are the reason I gave the movie any stars at all. The concept of patriarchy certainly isn't anything new and IMO there are much better films on the subject - starting with any of the Jane Austin films and this director's other film - Little Women."
7/10,It's Barbie and It's Ken,07 2023,"On a comedic level, Barbie is perfect. Obviously aware of trending topics and internet memes, the movie never fails to burst waves of laughter every three to five minutes. Every element in this film will become a punchline at one point or another, including awkward dialogues, exaggerated movements, unexpected responses, the Sex Education trio, John Cena cameo, Helen Mirren's epic one-liner, and much more. One actor to be complimented is Ryan Gosling, who bestows a childly himbo character Ken with charismatic idiocy and amusing lightheartedness, in great contrast to his previous sigma characters like K from Blade Runner 2049."
10/10,Refreshing new genre,07 2023,"A breath of fresh air, what an inspirational film on so many levels. Gretta showing the world of screenwriting just how it's done. I can't wait to see what new wave this brings to our cinemas. And what stories it inspires in younger generations of female creatives. If you don't agree, you're missing the point. Watch it again and listen to the subtext. And look around you, how many people came wearing pink? Don't underestimate the pink pound!"
10/10,A fun enthralling journey,07 2023,"You will experience vast emotions during this film. It's a thrill to watch, funny and fresh comedy. If I had any critiques for the film, I'd put them, but I enjoyed watching and will rewatch it. I felt like a little kid again at the movies. Totally absorbed with the story. It's a fictional land, while the film is so raw. Margot Robbie is a joy to watch and showed an impressive performance. I believed she was Barbie. The movie is played out as if the characters are dolls being played with. I imagined being a kid with my dolls, thinking of similar outrageous plots, dialogue, and wardrobe changes. Anyone can enjoy this film."
7/10,An unrisky yet effective comment on gender issues,08 2023,Warning: Spoilers
2/10,Mess of a movie,07 2023,"Anyone who gives this movie above a 1 star has a vested financial interest in its success. This was basically just a mess of a movie. All over the place plot with nonsense scenes and situations. There were some funny scenes but at its core, it just had no depth, logic or meaning other than Barbie v. Ken. Let's present a fake world where either men rule and women are puppets or women rule and men are puppets. This reads like someone's thesis on the state of feminism in modern society. I feel bad for the families that took their children to see this expecting something lighthearted and fun. This was not it. Just silly..."
10/10,the love letter to girls we all needed,07 2023,Warning: Spoilers
7/10,"Entertaining, silly summer movie but not really a funny comedy",07 2023,"Overall, this movie was about what I expected. It was a fun, summer blockbuster packed with stars and it felt like a nice, fresh break from all the superhero movies and rehashed stories that have been pushed out lately. It's not perfect, and I feel the messaging at times was too blunt, but the elements of the movie that were silly and enjoyable balanced it out"
3/10,Not for little girls. Not for anyone actually.,07 2023,"What could have been a cute concept was overproduced with obvious writer infighting pulling this disaster into all directions. A little girl friendly opening act quickly dissolves into act two social discussion that would leave any little girl bewildered. The family next to us described their three little ones as totally confused and everyone they heard discussing it was very disappointed with this disaster caused by feuding writers or a director who scored hilarious with ""Good Boys"". So, not for kids, and parents should wait for home viewing so they can turn it off when it wears really thin about a half hour in: the time it is realized its just not going to get any better and you turn it off thankful you didn't waste any money."
10/10,Hilarious with genuine touches of emotion,07 2023,I went in to this movie expecting to it to be fun based on the trove a press for it.
7/10,You're supposed to love being a mother but don't talk about your kids all the damn time.,08 2023,Overall: 7.47
8/10,A Flamboyantly Doll-lightful Adventure,07 2023,"My mother was the only person I could convince to go watch Greta Gerwig's ""Barbie"" (2023) with me, and ""wow"" am I glad we went. It's been a while since I've seen such a genuinely fun and creative movie. Originality is what the world has been longing for!"
7/10,Conversation-starter,08 2023,"This movie is like an interesting conversation you strike up with a stranger, touching on all sorts of things but never really going deep into anything. I guess you can see it a trigger to discuss gender roles and existentialism with your friends after watching it. Unlike the Barbies though, most people tend to not form a life outlook after one powertalk."
8/10,A Barbillion Bucks,08 2023,"Barbie, like The Lego Movie, is a product film based on a product so successful it doesn't need to sell said product and instead uses the guaranteed exposure to tell its own fairly unique story."
7/10,lighthearted and fun,07 2023,Warning: Spoilers
5/10,A Glamourous but Poorly Executed Product,08 2023,"In Barbieland, Stereotypical Barbie, played by Margot Robbie, experiences changes both mentally and physically, much to the surprise of the other Barbies. To find the answers she is looking for, Stereotypical Barbie must venture out into the real world, accompanied by her Ken, played by Ryan Gosling. On the plus side, the production design is striking. Barbieland is visually interesting, managing to feel fake, but lived in at the same time. The actors seem to have fun in the roles they are playing, Ryan Gosling's Ken being a stand out, making the best of the material he has. Margot Robbie also fulfills the role at playing a believable Barbie. Unfortunately, the overall execution of the film was disappointing. Most of the humor didn't land for me, though it did have its moments. Then there is the mixed messaging regarding gender roles. The film clearly states what it is trying to say (not subtle at all), but at the same time, undermines it through poor writing and characterization. Likewise, other attempts for the story to get deep end up falling flat by getting in its own way. While Barbie has its moments, it ends up getting held back by poorly executed ideas. Final verdict: 5/10."
10/10,Way better than expected,07 2023,"I was amongst the people who thought they saw a majority of this film based on all of the filming stills posted on the bird app in 2022. I still wanted to see it. Something about their perfect neon rollerblading outfits. I saw one preview and wasn't sure what the plot was going to be, I didn't care, I still wanted to see it. I wasn't expecting it to be amazing, but amazing it was. Well done!! Margot really knocked it out of the dollhouse. Ryan I'll never look at the same way way again. This 1980s Barbie Superman is very pleased. It won't be long until the opening dance scene is all over the clock app. I haven't felt so compelled to learn choreography since Michael Jackson's Thriller. Also, girls rule. Sorry, Ken."
7/10,I'm just Ken,08 2023,I only saw this movie for Ryan gosling and I was not disappointed. Bro brought the humor into this movie like he does with every movie that he is in. His performance was impeccable and kenough. To be fair I was a bit high so I was laughing a lot in the theatres and I was with my gf also seeing the movie. And I just love how Ryan aka ken brought the character to life in a special way. And of course the song he made is just absolutely wonderful in everyway. One of his best performances ever highly recommend for kids and for families to go and enjoy themselves. As Ryan gosling would say I'm just Ken and I'm enough.
10/10,Truly fantastic,07 2023,Warning: Spoilers
8/10,Loved it!,08 2023,"As we all know the title of the movie suggest fun, tons of 'cheesy' moments, drama and a lot of imaginations. I entered the theater expecting the same and placed all my expectations low and just go how the film flows. Surprisingly, it has a lot of funny moments in the film, at times 'silly', but it was all understandable and placed creatively and entertaining. Margot Robbie as ""Barbie"" was surely a perfect role of her, while Ryan Gosling as ""Ken"" did the same and he was more funnier as expected! Visual effects were cool to watch and soundtrack was for me, a phenomenal! People do see mixed reviewed after seeing it, but do see Barbie as a film and enjoy its ride!"
10/10,<3,07 2023,"This movie was so perfect especially as someone who has grown up with Barbie and was in pure awe of her from birth to the age of 12. I was forced to grow up due to peer pressure when I hit twelve so bye bye Barbie. I always regretted doing that because I wasn't ready to say goodbye but everyone else my age was. It breaks my soul seeing young girls, younger than I was letting go of their childhood so quick, trying to keep up with the older teen trends. It breaks my soul because if I was one of those girls I would be crying for my Barbie while conforming to society. Gloria's speech absolutely rocked my world. I need that tattooed in my brain, Greta is an absolute inspiration to women and girls everywhere. One thing about Barbie is I would not have an education without her. When I started school I refused to do my work unless I was promised a Barbie when I returned home, and it worked. If Barbie had not inspired women so long ago, I would probably not have completed my education as I would have found there to be no point. One thing is that I am sad or is a Barbie movie for one reason only, men will not likely see this. My brother and dad had no interest in even looking at promotion or trailers, there is no way I can get them to see this masterpiece, and they NEED to see this it is so important. If there is one movie that can change the course of history it is this one, as the introduction of Barbie did. I'm so proud and excited for Greta Gerwig and what is to come. As a newly out of school 18 year old my passion is to become a director or an actress, and Greta's work delights me everyday because of Greta, I have a chance. Before Greta's movie, I actually never heard of a female director in film, so it never even came into my head as a possibility before Greta came in. This movie has come at a perfect time for me as I turned 18 last month so this is my kickstart to womanhood, and what a way to start. I ask every woman and girl to watch this and I ask them to drag whichever man in their lives that they can. This movie is the epitome of ""yes"" there are no other words to perfectly signify this. Now, after all the mushy stuff, the humour in this film was perfect, there was never a cringy joke moment unless it was intended that way, and they never put a joke in a bad place. I was slightly worried the album may overshadow the movie, but it was perfect, never took anything away from the movie. Ryan Gosling did a fantastic job because I really believed he was Ken, nothing in me could say ""yeah that's Ryan"". Margot did a superb performance of Barbie, it is hard to play a doll that is perfect yet is experiencing an existential crisis of emotion, she deserves more praise."
6/10,Watch it in 70MM if you dare !!!!,07 2023,"I watched this movie on an IMAX theater in my hometown (Qatif); it's considered a 70MM cinema in our standards.. As everything was vividly pink, that particular experience made my eyes very sore!! Despite that, I can safely say that the Barbie film is somehow a funny ridiculous film and I would confidently recommend to watch it over watching Nolan masterpiece of garbage (oppenheimer)."
10/10,It's more than a story of a plastic doll,07 2023,"My expectations were very low for the movie but I am surprised. The Movie was literally good, the cast were fantastic, the set up delivered the fabulousness of the B world! Margot Robbie is a great choice for Barbie. I hope to see some elements from lgbti+ but it did not bothered me at all. Planning to go and see again."
7/10,"A Dazzling Dive into Feminism, Perfection, and Societal Expectations :)",08 2023,"Hello, Upon watching ""Barbie,"" directed by Greta Gerwig, I was immediately struck by the breathtaking visual spectacle the film offers. The vibrant universe and the ensemble cast, led by Margot Robbie and Ryan Gosling, transported me through a range of emotions. Robbie, in particular, impressed me with her charisma and depth."
4/10,Bafflingly mediocre,07 2023,"I have been thinking for 2 days and still I have no idea who the target audience for this film is. The first half of this movie is not bad at all but once Barbie and Ken leave barbieland the movie just completely falls apart. The message shoved in your face way too much and isnt subtle at all, characters that are set up early on are completely forgotten by the 3rd act in a bloated script filled with unnecissarily complex feministic views. For a movie about a children's toy, the dialogue is often much too complex and theres no way in hell a child is going to be able to understand whats going on; several lines left me scratching my head as the dialogue is way too overly complex. Ryan Gosling and Margot Robbie are excellent casting choices with Gosling going above and beyond, nailing all of the comedic moments and elevating all of the material he was given to work with."
6/10,If you are looking for a fun movie you came to the right place!,07 2023,"I liked how the movie was fun and colorful and had a basic story, if you want to chill and have fun this is the right movie, I watched it after Oppenheimer."
9/10,Greta Gerwig One of the Most Unique Voices in Hollywood,07 2023,Warning: Spoilers
6/10,Something was missing,07 2023,Warning: Spoilers
10/10,It's Barbie,07 2023,I never cared for Barbie but the movie is really good I think the casting is perfect and the music and who they got to do the soundtrack I also love how they made the Barbie world a separate land and it was brighter then the whole world and I love how they went to the Mattel head quarters and the people trying to take her away and Barbie and Ken being in the real In the real world also the marketing team did amazing on the promo and advertisement on the movie with all the company's collab with Barbie and etc so overall the Barbie movie got a lot of hype and well deserved excellent film and amazing for people who love barbie.
6/10,"A largely positive message, wrapped in a fun package but the execution could have been improved",07 2023,"Firstly, the marketing for Barbie was great. The cinema was full of people wearing Pink when I watched Barbie on Friday and Oppenheimer on Saturday."
7/10,Not what I expected,08 2023,"As of today's date, I would say this is the film produced by Luckychap Entertainment that I've liked the least, despite a more than promising trailer. Despite a perfect cast (Margot Robbie & Ryan Gosling seem to be born to play these roles, and the adorable America Ferrera & Emma Mackey are always a delight to have on screen) + sets & atmosphere that exceeded my expectations, I wasn't convinced by the storytelling at the end. The first half of the film is great, but things get complicated when Barbie & Ken leave Barbieland, and here we fall into the trap of a war of the sexes, when I think it would have been more appropriate to try and raise awareness of the fact that ""domination"" never serves anyone. In short, the film is worth seeing, but I have to admit that given my expectations of it, I'm a little disappointed, even if the costumes/settings/acting are stunning."
1/10,Atrocious,09 2023,"Don't know where to begin. This movie is a bland salad. Can't believe I actually see people throwing around the word masterpiece to describe this complete and utter trash of a movie. Jaws, schindlers list, inception, kill bill. Those are masterpiece. This movie is master poop. If u are having trouble falling asleep then watch the first half of the movie. It's a snoozer. Script is clumsy. This movie is what is wrong with cinema and television as of late. Don't know who they are making movies for. This is definitely not for the general public. This isn't a movie anyone wanted to see. The masters like Christopher Nolan could fart a better movie than this."
10/10,Speechless,08 2023,"Words cannot express successfully how I feel about this movie. I want to first say how important this movie is for women in the industry. As a woman who's dream is to be a filmmaker and being so young this is a monumental achievement in my eyes. This movie has made me excited to see what younger minds can do. It has a wonderful creative voice and a beautiful mix of comedy and respectfully addresses hard topics in a way that I think everyone can benefit from. I can understand how some people find it preachy but I disagree because this is a love letter to women. There are so many things that stuck with me and I will probably remember forever. I am impressed with the amount or detail, creativity, and love that was so obviously put into this movie. Greta Gerwig and the rest of the production team did a beautiful job creating an immersive thought provoking experience that brought me to tears. This is by far Margot and Ryan's best performance I've seen and they deserve all the love for it. The sci-fi references are also a very interesting touch that I didn't expect. I think this is a movie than everyone can take something away from and it is very special to me."
7/10,So perfectly casted,07 2023,I'm so happy with the casting that I can look past some other issues. It wasn't as nostalgic as I would have wanted it to be but this is definitely a new generations barbie movie. It really checked all the boxes with me. Fun costumes and great performances. It was fantasy and also very real. I can't think of anyone that could ever be better as Barbie than Margot Robbie. This was the perfects storm and it was a long time coming. Greta Gerwig's directing was fun and the script was inspiring. This movie won't be for everyone for sure but as a long time barbie fan I'm pleased. They left the movie in the perfect place and I don't need more. One and done and I'm ok with it.
10/10,Greta did it!,07 2023,Greta Gerwig did it. Broke the ceiling financially for a movie directed by a woman.
