score,title,date,text
4/10,Just ok - end falls flat,07 2023,"Although the Barbie movie's funny bits were good for one viewing, and there were several funny bits throughout the film, I think the writer/director wrote herself into a corner so the ending just falls flat. The parodies were funny, and the contrasts with real life were funny, but the writers just didn't know where to go with the story in the end. A lot of Greta Gerwig's films are like that. Disappointing. I wouldn't see the Barbie movie more than once, which is sad, because I've seen Dial of Destiny four times, and I am going back for a fifth viewing. That film did not disappoint! This one could have been a lot better."
10/10,if you're mad you missed the point,07 2023,Warning: Spoilers
5/10,Barbie,09 2023,"The 2023 movie ""Barbie"" is a surprisingly subversive and thought-provoking film that takes a sharp look at gender roles and expectations. Directed by Greta Gerwig and starring Margot Robbie and Ryan Gosling, the film has good visual with a sharp script and great performances."
10/10,it represents everything a girl is too afraid to say,07 2023,"The theatre was filled to the brim with 99% women and girls wearing pink, we felt united in the moment of watching such a beautiful film. It's a comedy but it also offers a glimpse into the real world and what it's like for girls and women daily. It was beautiful and i can only wish for more people to go and see it. The laughs and the jokes were only a small portion of the emotions we felt we could just let out, it was emotional in the best way possible and was a moment that i am thankful i could share with my bestfriend. Directors like Greta Gerwig are what we need in this world for it to be complete."
10/10,Total Delight!,08 2023,"Wish I could give Barbie 11 stars! I haven't had this much fun at the movies in a very long time! In fact, I've already seen it FOUR times and if I can find another friend who hasn't seen it yet, I'll go again!"
7/10,Barbie (2023) - Surprisingly Heartwarming and Entertaining!,07 2023,"When I first heard about the release of ""Barbie"" in 2023, I must admit I didn't have high expectations. After all, it's a movie based on a doll beloved by generations of young girls, and I wasn't sure how that would translate into a compelling cinematic experience. However, I was in for a pleasant surprise!"
10/10,Wow just wow,07 2023,"I saw this movie opening night and my expectations were beyond met and exceeded the limitations of what I thought a good movie was. It was one of the best movies I've ever seen. I was moved completely and entirely. I laughed, I cried, and I left the movie changed. It is a masterpiece. For those who don't understand, I highly recommend watching the movie again. The writing, the characters, the set, and the outfits were so brilliantly curated. I do not even hesitate to say it is now one of my favorite movies and one of the best movies I have EVER seen. Greta Gerwig is nothing less than a genius and deserves ALL of the recognition. The casting was perfection. The meaning behind the movie holds a special place in my heart and EVERY SINGLE PERSON NEEDS to see this movie. My favorite part of the movie was not ONLY the movie itself but the effect it is having on the communities surrounding it. The collective unspoken rule of dressing up to go see this movie. Brilliant."
7/10,"Good Cinematography, Delusional Plot and Message",08 2023,Warning: Spoilers
3/10,Ryan gosling is the best part of this movie,07 2023,"This movie is a feminist fever dream that teaches young girls that they will never be successful in the world as long as men exist, and that men are horrible, ironically Ken played by Ryan Gosling is the best part of this movie, bringing more laughs than anything else."
10/10,literally perfect,07 2023,"It exceeded my expectations. Truly an amazing film. Everything was gorgeous, the actors were perfect for their roles, the music was awesome (i'm just ken is top tier), the plot was super interesting, the outfits were amazing and truly connected with barbies through history, which leads me to say that is also a historical movie that shows the different barbies that existed or/and got cancelled through the decades."
7/10,Margot 10/10,09 2023,Not sure what to think about this movie but Margot Robbie is always great to watch and Ryan gosling is consistently great in all his movies these two definately ups my rating of the movie. Was left feeling a little bit underwhelmed! I might just watch it again because I'm sure I missed something in the plot the first time. The soundtrack is perfect for this very colourful film especially Billie eilish What was I made for and would be a shame if it didn't win an Oscar for best song at next years awards ceremony. Overall it was a pleasant watch but like all movies which are overhyped I wanted something more👍
4/10,Wish i liked it more,08 2023,"The hype and marketing drag me to this movie. I felt a little disappointed. Even though I did not had high expectations. It was not a bad movie. But it clearly isn't deserving that 7+ from me that it has now (in my opinion). The beginning is so strong but towards the end it's getting more disappointing. Great acting, great visuals/colors but sadly a very bad story. And yes the end is nicely done. But overall.. Not so great. Probs to the creators of reaching this milestone with great marketing and all the hype around it like tiktoks. Just watch it at home on a sunday where you wanna clear your mind a bit and have a little laugh."
8/10,"Surprises You, Entertains You",07 2023,"One might think this is a girly movie made for teenage girls and may be the early 20s. It starts off misleading the audience into a fun filled ride of jokes and conscious silliness at the start. Later, as we all settle into the Barbie world, it slides in Feministic conversations. At one point you think whether it's an adaptation of ""Men are from Mars..."" book, because they hit you deeper than the laugh you make of the dialogue."
10/10,perfect.,08 2023,"Everything was just so perfect. The cast, margot robbie is basically my fav person and ryan is also nice.. ig. I love how they added some actors from sex education like emma, connor and ncuti. The design was unbelievably perfect as well, the soundtrack, THE MESSAGE, EVERYTHING. I JUST LOVED THIS MOVIE SO MUCH IT WAS SO FUN TO WATCH. It felt relatable, felt so many kinds of emotions at once which was an amazing and unique experience. LOVED IT GRETA AND MARGOT DID SO WELL!! I also loved how there were so many kinds of barbie's, like transgender barbie, allan which i think is non-binary and more."
7/10,Close Kenough,07 2023,Warning: Spoilers
8/10,Hilarious and Thoughtful,07 2023,"This is actually very close to a great movie. It deserves your time and money at the theatres. Remember Lego Movie? How no one was expecting anything from it, labelling it as a cash grab? And it actually turned out to be a thoughtful, clever comedy? This movie is just as good."
7/10,Surprisingly well-layered,08 2023,"Barbie has captured many nuances of the societal stereotypes, challenged these tenets with a tactful yet fun twist. The main standout truly is the costume design. Highly diverse yet coherently put together to honor the Barbie concept. Borrowing elements from the Chanel's haute couture collection, to some of the rarest outfits from Barbie, it was such a unique experience to observe such understated works of art; even the extras/minor characters were wearing beautiful pieces. Some of the best costume design I've seen over the years."
5/10,"First half excellent, second half clunkily on-the-nose",08 2023,Warning: Spoilers
9/10,An Extremely Clever and Entertaining Experience,07 2023,"Well, if a film like The Lego Movie can come out and be clever and great, I guess a Barbie film can as well. I will always hesitate when a product receives a film based on it because it just seems shameful in terms of marketing. Audiences will always receive a few diamonds in the rough though, and Barbie is just that. It's definitely the most fun I've had at the movies this year. It's a lot more than just bright colours so let's get into it."
7/10,Started Strong But Ended Weak,07 2023,Warning: Spoilers
3/10,No Way This Is A Good Movie,07 2023,Barbie represents opression of women all around the world ruled by men. Ken represents manhood without capitalism or without a genital... blah blah blah...
6/10,"Mixed Bag: Good Moments, Simplistic Themes",08 2023,Warning: Spoilers
10/10,beautiful movie,07 2023,"I believe that everyone who said it was preachy just doesn't get it, the joy and pain this movie brought me makes it such a wonderful piece of art. The pacing of the movie was excellent as well. I never found myself checking the time waiting for it to end, i was engaged throughout. The comedy in the movie is very well done it felt fresh and not coming across as trying to hard. For me the best part was the end, that beautiful montage of women the cast and crew submitted to remind us that these women are all around us everyday and that we need to love eachother most of all. I will definitely watch it again."
6/10,A fun movie with a tiny bit of complexity,09 2023,Warning: Spoilers
10/10,Surpassed My Expectations,07 2023,"I did not know what to expect from the Barbie movie when I went with my two adult daughters. I was very pleasantly surprised! The movie made me laugh and it sometimes brought a tear to my eye (but I mostly laughed through it). The sets are spectacular. I would not be surprised if the movie wins an Academy Award for at least the set design. Ryan Gosling is very funny as the underrated Ken and Margot Robbie is very well suited to play the iconic doll. A very good commentary on how, sometimes, the Real World works. The story was, at times, very touching, but it's mostly a really good time. I loved it!!"
6/10,Strange but it has its positives,07 2023,"Barbie was certainly unique. It has a simple plot which well fits its target youth audience, it does have moments of comedy but don't expect any other sorts of genres. Both Ryan Gosling and Margot Robbie give a good performance which is convincing at times but not always. Greta Gerwig sometimes shows reasonably interesting and unique cinematography however most of the shots and music are predictable. This movie was packed with a star studded cast which lives it up to a greater name than it deserves. If you have young children they will certainly enjoy it, but if not I wouldn't recommend it to you."
4/10,"Enjoy the movie, feminists!",07 2023,"Barbie is the problem with modern Hollywood. I'm not a sexist, but this movie shows how all men are trash. The ending drags so long, just tell ""the message"". There are some gags that landed and the whole theater, packed with girls, laughed, but there were some, where the theatre was quite and i could hear only the fart of the woman sitting next to me. If the main villian Will Farrel, wasn't there, the movie is gonna be a little better, because the villians do nothing and only drag the pace of the movie. Greta Gerwig for the most part, did a pretty good job and the casting is perfect. Ryan Gosling is born for this role and Margot Robbie is great, as i expected. Overall, the movie is not for me. The little girls will deffinely like a lot more, than i did."
9/10,Nothing short of brilliant - could be a game-changer,07 2023,"Barbie is an anomaly, a force of nature, and could potentially be some sort of trendsetter in ways I can't quite fathom yet. I never expected a good Barbie movie to exist, especially not one that is so poignant and rich with satire, ambition, and intellect. But, this movie isn't just good - it's fantastic."
7/10,"Goood movie, bad plot",08 2023,Warning: Spoilers
2/10,Not for me.,07 2023,"I was thinking that Barbie was going to be a light hearted family movie.....it is not. You don't want to take the kids to this movie. I mean that was probably obvious from the trailer, casting and vibe. But if you were looking for a fun movie to take you away from the everyday heaviness...this is not that movie. If you want eye candy and lots of posturing and narrative sequences, then this movie is for you....otherwise I'd say don't go. Greta Gerwigs third directorial outing could have been so much more....sadly it does not live up to the hype. I just don't understand why they can't seem to make enjoyable movies that transport you away anymore."
10/10,It was worth it.,07 2023,"My childhood was spent with Barbie, Barbie's films and dolls, bag, clothes and notebook...and now I'm so happy and grateful. Watching this movie tooks me back to my sweet childhood memories. Everything was that I expected. Pink world and lots of beautiful Barbie's and handsome Ken's gathered together. And it's interesting that just as we played with our dolls, the Barbies in the movie were also taken into play! Then one of my childhood dreams that was Barbie in the real world came true and it was interesting to me... How wonderful it is that Margot Robbie was chosen to perform this role.. She did it perfectly."
10/10,See it for yourself - don't rely on other people's reviews,07 2023,Warning: Spoilers
6/10,Great potential but messy closure,07 2023,"Up to 80% of the storyline the film was great and tapped into essential topics of personal development and gender identities, reflecting and criticising society. The cast and characters had flair in the right amount of depth and dimensionality as well as chemistry amongst them. Also great that by the time the choreographed dancing scene(s) came in, the viewer had gotten the chance to properly care about what had been building up and then, the songs had real impact. It made for some good fun and laughs."
7/10,Is it really the movie of the summer?,07 2023,"I have many opinions when it comes to this movie. The movie itself was great, but as everything in life nothing is perfect."
10/10,Barbie is a great and funny movie!,08 2023,Warning: Spoilers
6/10,Funny jokes and lego the movie with barbie,07 2023,Warning: Spoilers
4/10,"An comment about feminism, men & gender equality",07 2023,"An film that tries to balance out humor and leaving social criticism in the minds of the viewers. Barbie falls flat with its criticism not only because it feels flat and out of place, but most importantly unnatural and unimportant."
10/10,Barbie,07 2023,"This movie captures the frustrating yet wonderful feeling of being a woman in this world more than any other film I feel so seen and acknowledged. I ended up crying as the credits rolled just because I felt like all the emotions I couldn't put into words and no one could ever understand were said in this film. This is a movie for everyone, not just women, it makes us reflect about power roles and how we should all work together towards a more equal world for all."
7/10,"Great acting, great set, great meaning, but rushed storyline",07 2023,Warning: Spoilers
6/10,Brilliant Message but over-hyped,09 2023,Warning: Spoilers
10/10,"""Sublime!"" -Ken, 2023",07 2023,One of the most affectionately crafted and truly hilarious films of all time!
7/10,Funny and watchable,07 2023,Warning: Spoilers
3/10,Maybe it's me....,08 2023,I almost walked out but I was with my friends. I even wore a pink dress. I really wanted to like this movie but it was way too ridiculous for my liking. I should have known that it would be more for barbie fans but I was never really into Barbie.
10/10,Ken out of 10,08 2023,"Barbie exceeds all expectations, delivering a self-aware and meta comedy that appeals to both devoted fans and newcomers. The film's profound layers and sharp humor create an immensely satisfying experience, showcasing the best version of Barbie on a grand scale while embracing its wonderfully weird and unique qualities."
6/10,Fun but disappointing,07 2023,Warning: Spoilers
4/10,This started off great and then went horribly awry,08 2023,Warning: Spoilers
6/10,A magical journey with a confusing ending,07 2023,Warning: Spoilers
10/10,It's not what I expected but in a good way,07 2023,"The movie in my opinion is great, it's no Godfather but it's a movie about BARBIE it's supposed to be fun, easy going and delightful but also amazingly brings up the problems of todays women and MEN. It has a great portrayal of the difference between the barbie world and the real human world. The characters are weirdly relatable and understandable. Margot Robbie was the best pick for barbie and Ryan as Ken ( even tho some may disagree, but no just watch the movie he is perfect) it's really funny but also in some scenes very sad and relatable. I recommend watching this movie because of : 1. Humour the ending really caught me off guard ngl 😂 2. The movie not being dragged out and hard to watch 3. Interesting storyline even tho there are still those smarts that think it's basic. It's not. It made me realise some sadder things about characters like Ken and think about the human world 4. Message you gotta watch the movie for this one 😏 5. Great acting, dancing and yesss even singing its a bit basic and cheesy to put this to the list but I find it really impressive on how natural a human can act like a barbie."
7/10,Unexpected but so enjoyable,07 2023,"This plot of Barbie unexpected, I watched it with no real expectations and no other knowledge about what it would be like. Barbie took me by surprise at it had a super deep and meaningful plot on being a woman, what the barbie life is like vs what it actually is like to be a woman. Plus the ken parts were super hilarious, the whole cinema was falling out of our seats at Ryan Gosling, he played Ken so well. And it was great to have these funny moments through out, when some of the parts were more serious. But I wish it had more barbie references, maybe from the movies which is such a memory for me growing up, but it seemed to focus more on Barbies with jobs trying to show that Girls can grow up to do anything, but I guess they couldn't cater to everything as it might've been to hard to squeeze it all it."
7/10,Sublime,07 2023,Warning: Spoilers
5/10,The Godfather is way better,08 2023,Warning: Spoilers
10/10,Fabulously done,07 2023,"So, I didn't have that much of a high expectation going in to see this because I really wasn't sure what is was going to be. I grew up playing Barbie's and have watched the animated films many times with my kids."
7/10,I was skeptical but was pleasantly proved wrong,07 2023,Warning: Spoilers
5/10,"Should've been great, but is forced, not subtle or clever, and constantly repeats the same messages non-stop.",08 2023,"What a damn shame. A PG-13 Barbie movie from Greta Gerwig and Noah Baumbach with Margot Robbie and Ryan Gosling, intended for those who loved and hated Barbie. I was looking forward to seeing Barbie. However, even those who hated Barbie would not call her fascist. This film borrows from so many films, The Truman Show, The Lego Movie, Legally Blonde, Toy Story 1-3, Singing In The Rain, Born Yesterday, 2001: A Space Odyssey, Who Framed Roger Rabbit?, and so many more. Other films which I could not help but recall how they got it right, where this film did not."
7/10,Much Deeper Than I Thought,07 2023,"Going into the movie, i went in mostly blind and didn't expect much into the way it explored a deeper and more abstract plotline. Cast was star-studded and everything seemed to be in place, nothing off there. However, to me, the movie couldn't decide whether it wanted to be a more serious movie with a straight plotline or being goofy with a more abstract plotline. I think the humor was well-executed, but the movie leaned too much into both sides. By doing that, the potential in the movie if they had picked and focused on one solely was diminished. Excellent individual performances from ferrell, gosling, and greenblatt."
10/10,"10/10 amazing, a must see, not just a ""girly"" movie",07 2023,I thought the movie was amazing. Full of nuances.
7/10,The real crime is the requirement of a full-time dual income household,07 2023,Warning: Spoilers
9/10,A telling of modern day society through Barbie,07 2023,"Who would have thought that a film about Barbie would be one of the most original, fresh film of recent years."
6/10,Bizarrely entertaining,07 2023,"This was definitely an entertaining movie but it went in so many different directions at times. Also, the product placement and clear control from Mattel takes you out of the fantasy at times. Honestly, it is unique and not something really done before, so it gets points for that. It's a lot though. Just a lot going on, and not all of what was going on was necessary."
10/10,So unexpected and so good.,07 2023,"I came in with no expectations and no idea of the what movie was about... and I was blown away. Under the guise of Barbie's beautiful dreamworld, the movie touches on some very real themes. With that being said, I cried multiple times throughout. The balance between social commentary and comedy was excellent, however. While it occasionally came across heavy handed, that was very much the point and very intentional. Margot Robbie and Ryan Gosling both do such an amazing job of portraying Barbie and Ken. I will be rewatching to soak everything in for the second time. I highly recommend for everyone to watch!"
6/10,Fun! (not necessarily a compliment),09 2023,Warning: Spoilers
3/10,"Wonderfull setup, with a not so wonderfully excecuted message",07 2023,"The production and the costume design is absolutely wonderful, same goes to the most of the cast. With beautiful attention to detial, uncluding actual cars and houses that we played with."
10/10,Cinematic Masterpiece,07 2023,"The entire film I was thinking ""Literally me."" It is a perfect movie in every way, the choreography was absolutely stunning it was fantastic. This movie beats out Oppenheimer in every way possible, me and the boys pulled up to Barbie excited! Will Ferrell was pretty good too as well as all the actors. The Kens dancing as well as all the horses brought tears to my eyes. Also the best part I have to say is at the very end the Barbie song by Ice Spice it slapped I had to watch the credits just to listen to the song. 10/10 would recommend. This film was perfect in every way down to each and every frame."
7/10,"Funny, but wish things played out different",07 2023,Warning: Spoilers
10/10,Best movie of the year!!,08 2023,"There is literally nothing to not love about this movie. Timing, perfect. Comedy, perfect. Ryan Gosling? Also perfect. Please do yourself a favor and go see this movie or purchase it when it comes out. It's rare to see something that synthesizes nostalgia, the societal journey of growing up (that extends generations) and balances this with comedy. There is a reason this debuted so highly at the box office and I am certain this will solidify itself as a cultural centerpiece for film schools in the future. Not only does it highlight long existing issues that half of the population has to endure, it does so in a way that you feel seen and can see others."
6/10,Coming away a bit disappointed :/,08 2023,"I was super excited to see this movie but I'm coming away from the cinema a bit disappointed. The marketing for this was amazing and everyone who watched it said that its not going to be what I expect and so my expectations were very high. There were some clever jokes and very beautiful sets and costumes but honestly the plot was hard to follow and there was nothing very nuanced or clever about the message. I think this film is a little late, maybe it would have resonated better a few years ago when these conversations were first taking place but to me it doesn't add much value to the feminist cause. It's worth seeing as it's definitely of cultural interest, but I won't be rewatching it."
8/10,Pretty Pink,07 2023,"Barbie is a beautifully heart-warming extravaganza for both boys and girls alike. A gloriously pink, joy-filled experience that I can't wait to go and see again. From the wonderful set design and perfect casting to the brilliant soundtrack and story to match, there is something for everyone to enjoy."
3/10,overrated,08 2023,I think the idea is great and all but honestly for a movie about feminism the most enjoyable parts were the ken parts and its nothing we've never seen/heard before you know. Like the whole speech part ive heard all that a million trillion times. I struggled so hard to get through the movie the plot was hard to follow and the 'barbieland' doesnt really make sense. I also thought some stuff was just ridiculous like how they travel to the 'real world'. And im saying this as a woman and all but i think they could of done such a better job with a feminst movie honestly. Idk how people were crying im sorry JSHDS.
10/10,A HONEST REVIEW,07 2023,People who followed all the lawsuits and all the Barbies throughout the years. It broke every single Hollywood Law in the books. Mattel made Satire out of their own overprotection of the Barbie Product. Margot Robbie was a breath of fresh air when she produced and starred in Barbie. This is one movie for both males and females and those who absolutely HATE Barbie. It is pure comedy and will never stop laughing throughout the whole movie.
7/10,"Unfortunately, the capital B applies only to the title; otherwise it is just a C.",08 2023,"A difficult film to place. While it succeeds in entertaining and snatching a few healthy laughs-with quotes and jokes aimed mostly at an adept audience-it fails in my humble opinion in its underlying intention to convey a moral. The takeaways of the various Barbies, the monologues of the protoganist and her co-star are, in some ways, not only as anachronistic as they are predictable but all in all incomplete in their conclusions."
